23:57:23.500068 24:0a:64:2a:99:fa > fc:d7:33:62:c8:2e, ethertype IPv4 (0x0800), length 66: 192.168.0.106.42654 > 121.201.9.155.80: Flags [.], ack 2480562239, win 247, options [nop,nop,TS val 2032744 ecr 1717535703], length 0
23:57:24.500061 24:0a:64:2a:99:fa > fc:d7:33:62:c8:2e, ethertype IPv4 (0x0800), length 66: 192.168.0.106.42654 > 121.201.9.155.80: Flags [.], ack 1, win 247, options [nop,nop,TS val 2032994 ecr 1717535703], length 0
23:57:24.593267 fc:d7:33:62:c8:2e > 24:0a:64:2a:99:fa, ethertype IPv4 (0x0800), length 66: 121.201.9.155.80 > 192.168.0.106.42654: Flags [.], ack 1, win 71, options [nop,nop,TS val 1717546807 ecr 2025202], length 0


09:58:52.733405 24:0a:64:2a:99:fa > fc:d7:33:62:c8:2e, ethertype IPv4 (0x0800), length 74: 192.168.0.106.55518 > 202.89.233.104.80: Flags [S], seq 1857524518, win 29200, options [mss 1460,sackOK,TS val 522590 ecr 0,nop,wscale 7], length 0
09:58:52.733469 24:0a:64:2a:99:fa > fc:d7:33:62:c8:2e, ethertype IPv4 (0x0800), length 74: 192.168.0.106.55519 > 202.89.233.104.80: Flags [S], seq 4107959087, win 29200, options [mss 1460,sackOK,TS val 522590 ecr 0,nop,wscale 7], length 0
09:58:52.733509 24:0a:64:2a:99:fa > fc:d7:33:62:c8:2e, ethertype IPv4 (0x0800), length 74: 192.168.0.106.55520 > 202.89.233.104.80: Flags [S], seq 3519842941, win 29200, options [mss 1460,sackOK,TS val 522590 ecr 0,nop,wscale 7], length 0
09:58:52.733542 24:0a:64:2a:99:fa > fc:d7:33:62:c8:2e, ethertype IPv4 (0x0800), length 74: 192.168.0.106.55521 > 202.89.233.104.80: Flags [S], seq 3142252565, win 29200, options [mss 1460,sackOK,TS val 522590 ecr 0,nop,wscale 7], length 0
09:58:52.733573 24:0a:64:2a:99:fa > fc:d7:33:62:c8:2e, ethertype IPv4 (0x0800), length 74: 192.168.0.106.55522 > 202.89.233.104.80: Flags [S], seq 4041839912, win 29200, options [mss 1460,sackOK,TS val 522590 ecr 0,nop,wscale 7], length 0
09:58:52.733604 24:0a:64:2a:99:fa > fc:d7:33:62:c8:2e, ethertype IPv4 (0x0800), length 74: 192.168.0.106.55523 > 202.89.233.104.80: Flags [S], seq 1876755116, win 29200, options [mss 1460,sackOK,TS val 522590 ecr 0,nop,wscale 7], length 0
09:58:52.983808 24:0a:64:2a:99:fa > fc:d7:33:62:c8:2e, ethertype IPv4 (0x0800), length 74: 192.168.0.106.55524 > 202.89.233.104.80: Flags [S], seq 2294834810, win 29200, options [mss 1460,sackOK,TS val 522652 ecr 0,nop,wscale 7], length 0
09:58:52.983891 24:0a:64:2a:99:fa > fc:d7:33:62:c8:2e, ethertype IPv4 (0x0800), length 74: 192.168.0.106.55525 > 202.89.233.104.80: Flags [S], seq 2881973829, win 29200, options [mss 1460,sackOK,TS val 522652 ecr 0,nop,wscale 7], length 0
09:58:52.983944 24:0a:64:2a:99:fa > fc:d7:33:62:c8:2e, ethertype IPv4 (0x0800), length 74: 192.168.0.106.55526 > 202.89.233.104.80: Flags [S], seq 961222750, win 29200, options [mss 1460,sackOK,TS val 522652 ecr 0,nop,wscale 7], length 0
09:58:52.983990 24:0a:64:2a:99:fa > fc:d7:33:62:c8:2e, ethertype IPv4 (0x0800), length 74: 192.168.0.106.55527 > 202.89.233.104.80: Flags [S], seq 145348047, win 29200, options [mss 1460,sackOK,TS val 522652 ecr 0,nop,wscale 7], length 0
09:58:52.984035 24:0a:64:2a:99:fa > fc:d7:33:62:c8:2e, ethertype IPv4 (0x0800), length 74: 192.168.0.106.55528 > 202.89.233.104.80: Flags [S], seq 2698946921, win 29200, options [mss 1460,sackOK,TS val 522652 ecr 0,nop,wscale 7], length 0
09:58:52.984079 24:0a:64:2a:99:fa > fc:d7:33:62:c8:2e, ethertype IPv4 (0x0800), length 74: 192.168.0.106.55529 > 202.89.233.104.80: Flags [S], seq 679425500, win 29200, options [mss 1460,sackOK,TS val 522652 ecr 0,nop,wscale 7], length 0
09:58:52.992985 fc:d7:33:62:c8:2e > 24:0a:64:2a:99:fa, ethertype IPv4 (0x0800), length 74: 202.89.233.104.80 > 192.168.0.106.55518: Flags [S.], seq 186017418, ack 1857524519, win 8192, options [mss 1440,nop,wscale 8,sackOK,TS val 137148093 ecr 522590], length 0
09:58:52.993032 24:0a:64:2a:99:fa > fc:d7:33:62:c8:2e, ethertype IPv4 (0x0800), length 66: 192.168.0.106.55518 > 202.89.233.104.80: Flags [.], ack 1, win 229, options [nop,nop,TS val 522655 ecr 137148093], length 0
09:58:52.993237 24:0a:64:2a:99:fa > fc:d7:33:62:c8:2e, ethertype IPv4 (0x0800), length 1494: 192.168.0.106.55518 > 202.89.233.104.80: Flags [.], seq 1:1429, ack 1, win 229, options [nop,nop,TS val 522655 ecr 137148093], length 1428
09:58:52.993708 24:0a:64:2a:99:fa > fc:d7:33:62:c8:2e, ethertype IPv4 (0x0800), length 813: 192.168.0.106.55518 > 202.89.233.104.80: Flags [P.], seq 1429:2176, ack 1, win 229, options [nop,nop,TS val 522655 ecr 137148093], length 747
09:58:53.512233 24:0a:64:2a:99:fa > fc:d7:33:62:c8:2e, ethertype IPv4 (0x0800), length 813: 192.168.0.106.55518 > 202.89.233.104.80: Flags [P.], seq 1429:2176, ack 1, win 229, options [nop,nop,TS val 522785 ecr 137148093], length 747
09:58:53.534608 fc:d7:33:62:c8:2e > 24:0a:64:2a:99:fa, ethertype IPv4 (0x0800), length 74: 202.89.233.104.80 > 192.168.0.106.55521: Flags [S.], seq 1719725917, ack 3142252566, win 8192, options [mss 1440,nop,wscale 8,sackOK,TS val 131891562 ecr 522590], length 0
09:58:53.534669 24:0a:64:2a:99:fa > fc:d7:33:62:c8:2e, ethertype IPv4 (0x0800), length 66: 192.168.0.106.55521 > 202.89.233.104.80: Flags [.], ack 1, win 229, options [nop,nop,TS val 522790 ecr 131891562], length 0
09:58:53.534704 fc:d7:33:62:c8:2e > 24:0a:64:2a:99:fa, ethertype IPv4 (0x0800), length 74: 202.89.233.104.80 > 192.168.0.106.55523: Flags [S.], seq 1238842566, ack 1876755117, win 8192, options [mss 1440,nop,wscale 8,sackOK,TS val 157179131 ecr 522590], length 0
09:58:53.534722 24:0a:64:2a:99:fa > fc:d7:33:62:c8:2e, ethertype IPv4 (0x0800), length 66: 192.168.0.106.55523 > 202.89.233.104.80: Flags [.], ack 1, win 229, options [nop,nop,TS val 522790 ecr 157179131], length 0
09:58:53.534739 fc:d7:33:62:c8:2e > 24:0a:64:2a:99:fa, ethertype IPv4 (0x0800), length 74: 202.89.233.104.80 > 192.168.0.106.55520: Flags [S.], seq 2363805043, ack 3519842942, win 8192, options [mss 1440,nop,wscale 8,sackOK,TS val 140702898 ecr 522590], length 0
09:58:53.534754 24:0a:64:2a:99:fa > fc:d7:33:62:c8:2e, ethertype IPv4 (0x0800), length 66: 192.168.0.106.55520 > 202.89.233.104.80: Flags [.], ack 1, win 229, options [nop,nop,TS val 522790 ecr 140702898], length 0
09:58:53.534774 fc:d7:33:62:c8:2e > 24:0a:64:2a:99:fa, ethertype IPv4 (0x0800), length 74: 202.89.233.104.80 > 192.168.0.106.55519: Flags [S.], seq 3784852481, ack 4107959088, win 8192, options [mss 1440,nop,wscale 8,sackOK,TS val 162386774 ecr 522590], length 0
09:58:53.534789 24:0a:64:2a:99:fa > fc:d7:33:62:c8:2e, ethertype IPv4 (0x0800), length 66: 192.168.0.106.55519 > 202.89.233.104.80: Flags [.], ack 1, win 229, options [nop,nop,TS val 522790 ecr 162386774], length 0
09:58:53.534803 fc:d7:33:62:c8:2e > 24:0a:64:2a:99:fa, ethertype IPv4 (0x0800), length 74: 202.89.233.104.80 > 192.168.0.106.55522: Flags [S.], seq 2319296594, ack 4041839913, win 8192, options [mss 1440,nop,wscale 8,sackOK,TS val 186179125 ecr 522590], length 0
09:58:53.534816 24:0a:64:2a:99:fa > fc:d7:33:62:c8:2e, ethertype IPv4 (0x0800), length 66: 192.168.0.106.55522 > 202.89.233.104.80: Flags [.], ack 1, win 229, options [nop,nop,TS val 522790 ecr 186179125], length 0
09:58:53.535064 24:0a:64:2a:99:fa > fc:d7:33:62:c8:2e, ethertype IPv4 (0x0800), length 1494: 192.168.0.106.55523 > 202.89.233.104.80: Flags [.], seq 1:1429, ack 1, win 229, options [nop,nop,TS val 522790 ecr 157179131], length 1428
09:58:53.535216 24:0a:64:2a:99:fa > fc:d7:33:62:c8:2e, ethertype IPv4 (0x0800), length 1494: 192.168.0.106.55522 > 202.89.233.104.80: Flags [.], seq 1:1429, ack 1, win 229, options [nop,nop,TS val 522790 ecr 186179125], length 1428
09:58:53.535351 24:0a:64:2a:99:fa > fc:d7:33:62:c8:2e, ethertype IPv4 (0x0800), length 1494: 192.168.0.106.55521 > 202.89.233.104.80: Flags [.], seq 1:1429, ack 1, win 229, options [nop,nop,TS val 522790 ecr 131891562], length 1428
09:58:53.541808 24:0a:64:2a:99:fa > fc:d7:33:62:c8:2e, ethertype IPv4 (0x0800), length 287: 192.168.0.106.55521 > 202.89.233.104.80: Flags [P.], seq 1429:1650, ack 1, win 229, options [nop,nop,TS val 522792 ecr 131891562], length 221
09:58:53.543249 24:0a:64:2a:99:fa > fc:d7:33:62:c8:2e, ethertype IPv4 (0x0800), length 690: 192.168.0.106.55523 > 202.89.233.104.80: Flags [P.], seq 1429:2053, ack 1, win 229, options [nop,nop,TS val 522792 ecr 157179131], length 624
09:58:53.555131 fc:d7:33:62:c8:2e > 24:0a:64:2a:99:fa, ethertype IPv4 (0x0800), length 74: 202.89.233.104.80 > 192.168.0.106.55524: Flags [S.], seq 2884537098, ack 2294834811, win 8192, options [mss 1440,nop,wscale 8,sackOK,TS val 164804284 ecr 522652], length 0
09:58:53.555217 24:0a:64:2a:99:fa > fc:d7:33:62:c8:2e, ethertype IPv4 (0x0800), length 66: 192.168.0.106.55524 > 202.89.233.104.80: Flags [.], ack 1, win 229, options [nop,nop,TS val 522795 ecr 164804284], length 0
09:58:53.555272 fc:d7:33:62:c8:2e > 24:0a:64:2a:99:fa, ethertype IPv4 (0x0800), length 74: 202.89.233.104.80 > 192.168.0.106.55525: Flags [S.], seq 326045589, ack 2881973830, win 8192, options [mss 1440,nop,wscale 8,sackOK,TS val 124194071 ecr 522652], length 0
09:58:53.555306 24:0a:64:2a:99:fa > fc:d7:33:62:c8:2e, ethertype IPv4 (0x0800), length 66: 192.168.0.106.55525 > 202.89.233.104.80: Flags [.], ack 1, win 229, options [nop,nop,TS val 522795 ecr 124194071], length 0
09:58:53.555321 fc:d7:33:62:c8:2e > 24:0a:64:2a:99:fa, ethertype IPv4 (0x0800), length 66: 202.89.233.104.80 > 192.168.0.106.55518: Flags [.], ack 2176, win 513, options [nop,nop,TS val 137148119 ecr 522655], length 0
09:58:53.555342 fc:d7:33:62:c8:2e > 24:0a:64:2a:99:fa, ethertype IPv4 (0x0800), length 305: 202.89.233.104.80 > 192.168.0.106.55518: Flags [P.], seq 1:240, ack 2176, win 513, options [nop,nop,TS val 137148119 ecr 522655], length 239
09:58:53.555352 24:0a:64:2a:99:fa > fc:d7:33:62:c8:2e, ethertype IPv4 (0x0800), length 66: 192.168.0.106.55518 > 202.89.233.104.80: Flags [.], ack 240, win 237, options [nop,nop,TS val 522795 ecr 137148119], length 0
09:58:53.555367 fc:d7:33:62:c8:2e > 24:0a:64:2a:99:fa, ethertype IPv4 (0x0800), length 74: 202.89.233.104.80 > 192.168.0.106.55528: Flags [S.], seq 4280097016, ack 2698946922, win 8192, options [mss 1440,nop,wscale 8,sackOK,TS val 154167455 ecr 522652], length 0
09:58:53.555383 24:0a:64:2a:99:fa > fc:d7:33:62:c8:2e, ethertype IPv4 (0x0800), length 66: 192.168.0.106.55528 > 202.89.233.104.80: Flags [.], ack 1, win 229, options [nop,nop,TS val 522795 ecr 154167455], length 0
09:58:53.555398 fc:d7:33:62:c8:2e > 24:0a:64:2a:99:fa, ethertype IPv4 (0x0800), length 74: 202.89.233.104.80 > 192.168.0.106.55526: Flags [S.], seq 1166638760, ack 961222751, win 8192, options [mss 1440,nop,wscale 8,sackOK,TS val 141547228 ecr 522652], length 0
09:58:53.555413 24:0a:64:2a:99:fa > fc:d7:33:62:c8:2e, ethertype IPv4 (0x0800), length 66: 192.168.0.106.55526 > 202.89.233.104.80: Flags [.], ack 1, win 229, options [nop,nop,TS val 522795 ecr 141547228], length 0
09:58:53.555425 fc:d7:33:62:c8:2e > 24:0a:64:2a:99:fa, ethertype IPv4 (0x0800), length 74: 202.89.233.104.80 > 192.168.0.106.55527: Flags [S.], seq 716009882, ack 145348048, win 8192, options [mss 1440,nop,wscale 8,sackOK,TS val 120217257 ecr 522652], length 0
09:58:53.555447 24:0a:64:2a:99:fa > fc:d7:33:62:c8:2e, ethertype IPv4 (0x0800), length 66: 192.168.0.106.55527 > 202.89.233.104.80: Flags [.], ack 1, win 229, options [nop,nop,TS val 522795 ecr 120217257], length 0
09:58:53.555457 fc:d7:33:62:c8:2e > 24:0a:64:2a:99:fa, ethertype IPv4 (0x0800), length 74: 202.89.233.104.80 > 192.168.0.106.55529: Flags [S.], seq 3863486287, ack 679425501, win 8192, options [mss 1440,nop,wscale 8,sackOK,TS val 186179150 ecr 522652], length 0
09:58:53.555467 24:0a:64:2a:99:fa > fc:d7:33:62:c8:2e, ethertype IPv4 (0x0800), length 66: 192.168.0.106.55529 > 202.89.233.104.80: Flags [.], ack 1, win 229, options [nop,nop,TS val 522795 ecr 186179150], length 0
09:58:53.555476 fc:d7:33:62:c8:2e > 24:0a:64:2a:99:fa, ethertype IPv4 (0x0800), length 74: 202.89.233.104.80 > 192.168.0.106.55521: Flags [S.], seq 1719725917, ack 3142252566, win 8192, options [mss 1440,nop,wscale 8,sackOK,TS val 131891602 ecr 522590], length 0
09:58:53.555482 24:0a:64:2a:99:fa > fc:d7:33:62:c8:2e, ethertype IPv4 (0x0800), length 66: 192.168.0.106.55521 > 202.89.233.104.80: Flags [.], ack 1, win 229, options [nop,nop,TS val 522795 ecr 131891562], length 0
09:58:53.555493 fc:d7:33:62:c8:2e > 24:0a:64:2a:99:fa, ethertype IPv4 (0x0800), length 74: 202.89.233.104.80 > 192.168.0.106.55520: Flags [S.], seq 2363805043, ack 3519842942, win 8192, options [mss 1440,nop,wscale 8,sackOK,TS val 140702938 ecr 522590], length 0
09:58:53.555498 24:0a:64:2a:99:fa > fc:d7:33:62:c8:2e, ethertype IPv4 (0x0800), length 66: 192.168.0.106.55520 > 202.89.233.104.80: Flags [.], ack 1, win 229, options [nop,nop,TS val 522795 ecr 140702898], length 0
09:58:53.555507 fc:d7:33:62:c8:2e > 24:0a:64:2a:99:fa, ethertype IPv4 (0x0800), length 74: 202.89.233.104.80 > 192.168.0.106.55523: Flags [S.], seq 1238842566, ack 1876755117, win 8192, options [mss 1440,nop,wscale 8,sackOK,TS val 157179171 ecr 522590], length 0
09:58:53.555512 24:0a:64:2a:99:fa > fc:d7:33:62:c8:2e, ethertype IPv4 (0x0800), length 66: 192.168.0.106.55523 > 202.89.233.104.80: Flags [.], ack 1, win 229, options [nop,nop,TS val 522795 ecr 157179131], length 0
09:58:53.555521 fc:d7:33:62:c8:2e > 24:0a:64:2a:99:fa, ethertype IPv4 (0x0800), length 74: 202.89.233.104.80 > 192.168.0.106.55519: Flags [S.], seq 3784852481, ack 4107959088, win 8192, options [mss 1440,nop,wscale 8,sackOK,TS val 162386814 ecr 522590], length 0
09:58:53.555527 24:0a:64:2a:99:fa > fc:d7:33:62:c8:2e, ethertype IPv4 (0x0800), length 66: 192.168.0.106.55519 > 202.89.233.104.80: Flags [.], ack 1, win 229, options [nop,nop,TS val 522795 ecr 162386774], length 0
09:58:53.555535 fc:d7:33:62:c8:2e > 24:0a:64:2a:99:fa, ethertype IPv4 (0x0800), length 74: 202.89.233.104.80 > 192.168.0.106.55522: Flags [S.], seq 2319296594, ack 4041839913, win 8192, options [mss 1440,nop,wscale 8,sackOK,TS val 186179166 ecr 522590], length 0
09:58:53.555541 24:0a:64:2a:99:fa > fc:d7:33:62:c8:2e, ethertype IPv4 (0x0800), length 66: 192.168.0.106.55522 > 202.89.233.104.80: Flags [.], ack 1, win 229, options [nop,nop,TS val 522795 ecr 186179125], length 0
09:58:53.555549 fc:d7:33:62:c8:2e > 24:0a:64:2a:99:fa, ethertype IPv4 (0x0800), length 74: 202.89.233.104.80 > 192.168.0.106.55524: Flags [S.], seq 2884537098, ack 2294834811, win 8192, options [mss 1440,nop,wscale 8,sackOK,TS val 164804324 ecr 522652], length 0
09:58:53.555554 24:0a:64:2a:99:fa > fc:d7:33:62:c8:2e, ethertype IPv4 (0x0800), length 66: 192.168.0.106.55524 > 202.89.233.104.80: Flags [.], ack 1, win 229, options [nop,nop,TS val 522795 ecr 164804284], length 0
09:58:53.555562 fc:d7:33:62:c8:2e > 24:0a:64:2a:99:fa, ethertype IPv4 (0x0800), length 74: 202.89.233.104.80 > 192.168.0.106.55525: Flags [S.], seq 326045589, ack 2881973830, win 8192, options [mss 1440,nop,wscale 8,sackOK,TS val 124194111 ecr 522652], length 0
09:58:53.555568 24:0a:64:2a:99:fa > fc:d7:33:62:c8:2e, ethertype IPv4 (0x0800), length 66: 192.168.0.106.55525 > 202.89.233.104.80: Flags [.], ack 1, win 229, options [nop,nop,TS val 522795 ecr 124194071], length 0
09:58:53.555576 fc:d7:33:62:c8:2e > 24:0a:64:2a:99:fa, ethertype IPv4 (0x0800), length 74: 202.89.233.104.80 > 192.168.0.106.55529: Flags [S.], seq 3863486287, ack 679425501, win 8192, options [mss 1440,nop,wscale 8,sackOK,TS val 186179190 ecr 522652], length 0
09:58:53.555581 24:0a:64:2a:99:fa > fc:d7:33:62:c8:2e, ethertype IPv4 (0x0800), length 66: 192.168.0.106.55529 > 202.89.233.104.80: Flags [.], ack 1, win 229, options [nop,nop,TS val 522795 ecr 186179150], length 0
09:58:53.555590 fc:d7:33:62:c8:2e > 24:0a:64:2a:99:fa, ethertype IPv4 (0x0800), length 74: 202.89.233.104.80 > 192.168.0.106.55526: Flags [S.], seq 1166638760, ack 961222751, win 8192, options [mss 1440,nop,wscale 8,sackOK,TS val 141547268 ecr 522652], length 0
09:58:53.555595 24:0a:64:2a:99:fa > fc:d7:33:62:c8:2e, ethertype IPv4 (0x0800), length 66: 192.168.0.106.55526 > 202.89.233.104.80: Flags [.], ack 1, win 229, options [nop,nop,TS val 522795 ecr 141547228], length 0
09:58:53.555603 fc:d7:33:62:c8:2e > 24:0a:64:2a:99:fa, ethertype IPv4 (0x0800), length 74: 202.89.233.104.80 > 192.168.0.106.55527: Flags [S.], seq 716009882, ack 145348048, win 8192, options [mss 1440,nop,wscale 8,sackOK,TS val 120217297 ecr 522652], length 0
09:58:53.555608 24:0a:64:2a:99:fa > fc:d7:33:62:c8:2e, ethertype IPv4 (0x0800), length 66: 192.168.0.106.55527 > 202.89.233.104.80: Flags [.], ack 1, win 229, options [nop,nop,TS val 522795 ecr 120217257], length 0
09:58:53.555617 fc:d7:33:62:c8:2e > 24:0a:64:2a:99:fa, ethertype IPv4 (0x0800), length 74: 202.89.233.104.80 > 192.168.0.106.55528: Flags [S.], seq 4280097016, ack 2698946922, win 8192, options [mss 1440,nop,wscale 8,sackOK,TS val 154167495 ecr 522652], length 0
09:58:53.555622 24:0a:64:2a:99:fa > fc:d7:33:62:c8:2e, ethertype IPv4 (0x0800), length 66: 192.168.0.106.55528 > 202.89.233.104.80: Flags [.], ack 1, win 229, options [nop,nop,TS val 522795 ecr 154167455], length 0
09:58:53.555630 fc:d7:33:62:c8:2e > 24:0a:64:2a:99:fa, ethertype IPv4 (0x0800), length 78: 202.89.233.104.80 > 192.168.0.106.55518: Flags [.], ack 2176, win 513, options [nop,nop,TS val 137148171 ecr 522655,nop,nop,sack 1 {1429:2176}], length 0
09:58:53.562456 24:0a:64:2a:99:fa > fc:d7:33:62:c8:2e, ethertype IPv4 (0x0800), length 168: 192.168.0.106.55522 > 202.89.233.104.80: Flags [P.], seq 1429:1531, ack 1, win 229, options [nop,nop,TS val 522797 ecr 186179125], length 102
09:58:53.610442 fc:d7:33:62:c8:2e > 24:0a:64:2a:99:fa, ethertype IPv4 (0x0800), length 66: 202.89.233.104.80 > 192.168.0.106.55521: Flags [.], ack 1429, win 513, options [nop,nop,TS val 131891645 ecr 522790], length 0
09:58:53.610505 fc:d7:33:62:c8:2e > 24:0a:64:2a:99:fa, ethertype IPv4 (0x0800), length 66: 202.89.233.104.80 > 192.168.0.106.55521: Flags [.], ack 1650, win 512, options [nop,nop,TS val 131891645 ecr 522792], length 0
09:58:53.612723 fc:d7:33:62:c8:2e > 24:0a:64:2a:99:fa, ethertype IPv4 (0x0800), length 406: 202.89.233.104.80 > 192.168.0.106.55521: Flags [P.], seq 1:341, ack 1650, win 512, options [nop,nop,TS val 131891645 ecr 522795], length 340
09:58:53.612760 24:0a:64:2a:99:fa > fc:d7:33:62:c8:2e, ethertype IPv4 (0x0800), length 66: 192.168.0.106.55521 > 202.89.233.104.80: Flags [.], ack 341, win 237, options [nop,nop,TS val 522810 ecr 131891645], length 0
09:58:53.612797 fc:d7:33:62:c8:2e > 24:0a:64:2a:99:fa, ethertype IPv4 (0x0800), length 71: 202.89.233.104.80 > 192.168.0.106.55521: Flags [P.], seq 341:346, ack 1650, win 512, options [nop,nop,TS val 131891645 ecr 522795], length 5
09:58:53.612806 24:0a:64:2a:99:fa > fc:d7:33:62:c8:2e, ethertype IPv4 (0x0800), length 66: 192.168.0.106.55521 > 202.89.233.104.80: Flags [.], ack 346, win 237, options [nop,nop,TS val 522810 ecr 131891645], length 0
09:58:53.612819 fc:d7:33:62:c8:2e > 24:0a:64:2a:99:fa, ethertype IPv4 (0x0800), length 66: 202.89.233.104.80 > 192.168.0.106.55523: Flags [.], ack 1429, win 513, options [nop,nop,TS val 157179214 ecr 522790], length 0
09:58:53.612833 fc:d7:33:62:c8:2e > 24:0a:64:2a:99:fa, ethertype IPv4 (0x0800), length 66: 202.89.233.104.80 > 192.168.0.106.55523: Flags [.], ack 2053, win 510, options [nop,nop,TS val 157179215 ecr 522792], length 0
09:58:53.612840 fc:d7:33:62:c8:2e > 24:0a:64:2a:99:fa, ethertype IPv4 (0x0800), length 305: 202.89.233.104.80 > 192.168.0.106.55523: Flags [P.], seq 1:240, ack 2053, win 510, options [nop,nop,TS val 157179215 ecr 522792], length 239
09:58:53.612846 24:0a:64:2a:99:fa > fc:d7:33:62:c8:2e, ethertype IPv4 (0x0800), length 66: 192.168.0.106.55523 > 202.89.233.104.80: Flags [.], ack 240, win 237, options [nop,nop,TS val 522810 ecr 157179215], length 0
09:58:53.612859 fc:d7:33:62:c8:2e > 24:0a:64:2a:99:fa, ethertype IPv4 (0x0800), length 66: 202.89.233.104.80 > 192.168.0.106.55522: Flags [.], ack 1429, win 513, options [nop,nop,TS val 186179208 ecr 522790], length 0
09:58:53.614385 fc:d7:33:62:c8:2e > 24:0a:64:2a:99:fa, ethertype IPv4 (0x0800), length 66: 202.89.233.104.80 > 192.168.0.106.55522: Flags [.], ack 1531, win 512, options [nop,nop,TS val 186179208 ecr 522797], length 0
09:58:53.956530 fc:d7:33:62:c8:2e > 24:0a:64:2a:99:fa, ethertype IPv4 (0x0800), length 1494: 202.89.233.104.80 > 192.168.0.106.55522: Flags [.], seq 1:1429, ack 1531, win 512, options [nop,nop,TS val 186179231 ecr 522797], length 1428
09:58:53.956567 24:0a:64:2a:99:fa > fc:d7:33:62:c8:2e, ethertype IPv4 (0x0800), length 66: 192.168.0.106.55522 > 202.89.233.104.80: Flags [.], ack 1429, win 251, options [nop,nop,TS val 522896 ecr 186179231], length 0
09:58:53.956608 fc:d7:33:62:c8:2e > 24:0a:64:2a:99:fa, ethertype IPv4 (0x0800), length 1494: 202.89.233.104.80 > 192.168.0.106.55522: Flags [.], seq 1429:2857, ack 1531, win 512, options [nop,nop,TS val 186179231 ecr 522797], length 1428
09:58:53.956617 24:0a:64:2a:99:fa > fc:d7:33:62:c8:2e, ethertype IPv4 (0x0800), length 66: 192.168.0.106.55522 > 202.89.233.104.80: Flags [.], ack 2857, win 274, options [nop,nop,TS val 522896 ecr 186179231], length 0
09:58:53.956630 fc:d7:33:62:c8:2e > 24:0a:64:2a:99:fa, ethertype IPv4 (0x0800), length 796: 202.89.233.104.80 > 192.168.0.106.55522: Flags [P.], seq 2857:3587, ack 1531, win 512, options [nop,nop,TS val 186179231 ecr 522797], length 730
09:58:53.956637 24:0a:64:2a:99:fa > fc:d7:33:62:c8:2e, ethertype IPv4 (0x0800), length 66: 192.168.0.106.55522 > 202.89.233.104.80: Flags [.], ack 3587, win 296, options [nop,nop,TS val 522896 ecr 186179231], length 0
09:58:53.956646 fc:d7:33:62:c8:2e > 24:0a:64:2a:99:fa, ethertype IPv4 (0x0800), length 1494: 202.89.233.104.80 > 192.168.0.106.55522: Flags [.], seq 3587:5015, ack 1531, win 512, options [nop,nop,TS val 186179231 ecr 522797], length 1428
09:58:53.956652 24:0a:64:2a:99:fa > fc:d7:33:62:c8:2e, ethertype IPv4 (0x0800), length 66: 192.168.0.106.55522 > 202.89.233.104.80: Flags [.], ack 5015, win 319, options [nop,nop,TS val 522896 ecr 186179231], length 0
09:58:53.956661 fc:d7:33:62:c8:2e > 24:0a:64:2a:99:fa, ethertype IPv4 (0x0800), length 889: 202.89.233.104.80 > 192.168.0.106.55522: Flags [P.], seq 5015:5838, ack 1531, win 512, options [nop,nop,TS val 186179231 ecr 522797], length 823
09:58:53.956671 24:0a:64:2a:99:fa > fc:d7:33:62:c8:2e, ethertype IPv4 (0x0800), length 66: 192.168.0.106.55522 > 202.89.233.104.80: Flags [.], ack 5838, win 341, options [nop,nop,TS val 522896 ecr 186179231], length 0
09:58:53.956679 fc:d7:33:62:c8:2e > 24:0a:64:2a:99:fa, ethertype IPv4 (0x0800), length 1494: 202.89.233.104.80 > 192.168.0.106.55522: Flags [.], seq 5838:7266, ack 1531, win 512, options [nop,nop,TS val 186179231 ecr 522797], length 1428
09:58:53.956685 24:0a:64:2a:99:fa > fc:d7:33:62:c8:2e, ethertype IPv4 (0x0800), length 66: 192.168.0.106.55522 > 202.89.233.104.80: Flags [.], ack 7266, win 364, options [nop,nop,TS val 522896 ecr 186179231], length 0
09:58:53.956694 fc:d7:33:62:c8:2e > 24:0a:64:2a:99:fa, ethertype IPv4 (0x0800), length 1494: 202.89.233.104.80 > 192.168.0.106.55522: Flags [.], seq 7266:8694, ack 1531, win 512, options [nop,nop,TS val 186179231 ecr 522797], length 1428
09:58:53.956701 24:0a:64:2a:99:fa > fc:d7:33:62:c8:2e, ethertype IPv4 (0x0800), length 66: 192.168.0.106.55522 > 202.89.233.104.80: Flags [.], ack 8694, win 386, options [nop,nop,TS val 522896 ecr 186179231], length 0
09:58:53.956709 fc:d7:33:62:c8:2e > 24:0a:64:2a:99:fa, ethertype IPv4 (0x0800), length 1494: 202.89.233.104.80 > 192.168.0.106.55522: Flags [.], seq 8694:10122, ack 1531, win 512, options [nop,nop,TS val 186179231 ecr 522797], length 1428
09:58:53.956715 24:0a:64:2a:99:fa > fc:d7:33:62:c8:2e, ethertype IPv4 (0x0800), length 66: 192.168.0.106.55522 > 202.89.233.104.80: Flags [.], ack 10122, win 409, options [nop,nop,TS val 522896 ecr 186179231], length 0
09:58:54.050448 fc:d7:33:62:c8:2e > 24:0a:64:2a:99:fa, ethertype IPv4 (0x0800), length 1494: 202.89.233.104.80 > 192.168.0.106.55522: Flags [.], seq 10122:11550, ack 1531, win 512, options [nop,nop,TS val 186179231 ecr 522797], length 1428
09:58:54.050482 24:0a:64:2a:99:fa > fc:d7:33:62:c8:2e, ethertype IPv4 (0x0800), length 66: 192.168.0.106.55522 > 202.89.233.104.80: Flags [.], ack 11550, win 432, options [nop,nop,TS val 522919 ecr 186179231], length 0
09:58:54.050514 fc:d7:33:62:c8:2e > 24:0a:64:2a:99:fa, ethertype IPv4 (0x0800), length 1494: 202.89.233.104.80 > 192.168.0.106.55522: Flags [.], seq 11550:12978, ack 1531, win 512, options [nop,nop,TS val 186179231 ecr 522797], length 1428
09:58:54.050524 24:0a:64:2a:99:fa > fc:d7:33:62:c8:2e, ethertype IPv4 (0x0800), length 66: 192.168.0.106.55522 > 202.89.233.104.80: Flags [.], ack 12978, win 454, options [nop,nop,TS val 522919 ecr 186179231], length 0
09:58:54.050535 fc:d7:33:62:c8:2e > 24:0a:64:2a:99:fa, ethertype IPv4 (0x0800), length 1126: 202.89.233.104.80 > 192.168.0.106.55522: Flags [P.], seq 12978:14038, ack 1531, win 512, options [nop,nop,TS val 186179231 ecr 522797], length 1060
09:58:54.050542 24:0a:64:2a:99:fa > fc:d7:33:62:c8:2e, ethertype IPv4 (0x0800), length 66: 192.168.0.106.55522 > 202.89.233.104.80: Flags [.], ack 14038, win 477, options [nop,nop,TS val 522919 ecr 186179231], length 0
09:58:54.050549 fc:d7:33:62:c8:2e > 24:0a:64:2a:99:fa, ethertype IPv4 (0x0800), length 1494: 202.89.233.104.80 > 192.168.0.106.55522: Flags [.], seq 14038:15466, ack 1531, win 512, options [nop,nop,TS val 186179231 ecr 522797], length 1428
09:58:54.050556 24:0a:64:2a:99:fa > fc:d7:33:62:c8:2e, ethertype IPv4 (0x0800), length 66: 192.168.0.106.55522 > 202.89.233.104.80: Flags [.], ack 15466, win 499, options [nop,nop,TS val 522919 ecr 186179231], length 0
09:58:54.050562 fc:d7:33:62:c8:2e > 24:0a:64:2a:99:fa, ethertype IPv4 (0x0800), length 1494: 202.89.233.104.80 > 192.168.0.106.55522: Flags [.], seq 15466:16894, ack 1531, win 512, options [nop,nop,TS val 186179231 ecr 522797], length 1428
09:58:54.050568 24:0a:64:2a:99:fa > fc:d7:33:62:c8:2e, ethertype IPv4 (0x0800), length 66: 192.168.0.106.55522 > 202.89.233.104.80: Flags [.], ack 16894, win 522, options [nop,nop,TS val 522919 ecr 186179231], length 0
09:58:54.050574 fc:d7:33:62:c8:2e > 24:0a:64:2a:99:fa, ethertype IPv4 (0x0800), length 705: 202.89.233.104.80 > 192.168.0.106.55522: Flags [P.], seq 16894:17533, ack 1531, win 512, options [nop,nop,TS val 186179231 ecr 522797], length 639
09:58:54.050580 24:0a:64:2a:99:fa > fc:d7:33:62:c8:2e, ethertype IPv4 (0x0800), length 66: 192.168.0.106.55522 > 202.89.233.104.80: Flags [.], ack 17533, win 544, options [nop,nop,TS val 522919 ecr 186179231], length 0
09:58:54.050585 fc:d7:33:62:c8:2e > 24:0a:64:2a:99:fa, ethertype IPv4 (0x0800), length 1494: 202.89.233.104.80 > 192.168.0.106.55522: Flags [.], seq 17533:18961, ack 1531, win 512, options [nop,nop,TS val 186179231 ecr 522797], length 1428
09:58:54.050592 24:0a:64:2a:99:fa > fc:d7:33:62:c8:2e, ethertype IPv4 (0x0800), length 66: 192.168.0.106.55522 > 202.89.233.104.80: Flags [.], ack 18961, win 567, options [nop,nop,TS val 522919 ecr 186179231], length 0
09:58:54.050599 fc:d7:33:62:c8:2e > 24:0a:64:2a:99:fa, ethertype IPv4 (0x0800), length 1494: 202.89.233.104.80 > 192.168.0.106.55522: Flags [.], seq 18961:20389, ack 1531, win 512, options [nop,nop,TS val 186179231 ecr 522797], length 1428
09:58:54.050607 24:0a:64:2a:99:fa > fc:d7:33:62:c8:2e, ethertype IPv4 (0x0800), length 66: 192.168.0.106.55522 > 202.89.233.104.80: Flags [.], ack 20389, win 589, options [nop,nop,TS val 522919 ecr 186179231], length 0
09:58:54.050613 fc:d7:33:62:c8:2e > 24:0a:64:2a:99:fa, ethertype IPv4 (0x0800), length 1494: 202.89.233.104.80 > 192.168.0.106.55522: Flags [.], seq 20389:21817, ack 1531, win 512, options [nop,nop,TS val 186179231 ecr 522797], length 1428
09:58:54.050622 24:0a:64:2a:99:fa > fc:d7:33:62:c8:2e, ethertype IPv4 (0x0800), length 66: 192.168.0.106.55522 > 202.89.233.104.80: Flags [.], ack 21817, win 612, options [nop,nop,TS val 522919 ecr 186179231], length 0
09:58:54.050632 fc:d7:33:62:c8:2e > 24:0a:64:2a:99:fa, ethertype IPv4 (0x0800), length 1494: 202.89.233.104.80 > 192.168.0.106.55522: Flags [.], seq 21817:23245, ack 1531, win 512, options [nop,nop,TS val 186179247 ecr 522896], length 1428
09:58:54.050640 24:0a:64:2a:99:fa > fc:d7:33:62:c8:2e, ethertype IPv4 (0x0800), length 66: 192.168.0.106.55522 > 202.89.233.104.80: Flags [.], ack 23245, win 635, options [nop,nop,TS val 522919 ecr 186179247], length 0
09:58:54.050648 fc:d7:33:62:c8:2e > 24:0a:64:2a:99:fa, ethertype IPv4 (0x0800), length 1494: 202.89.233.104.80 > 192.168.0.106.55522: Flags [.], seq 23245:24673, ack 1531, win 512, options [nop,nop,TS val 186179247 ecr 522896], length 1428
09:58:54.050655 24:0a:64:2a:99:fa > fc:d7:33:62:c8:2e, ethertype IPv4 (0x0800), length 66: 192.168.0.106.55522 > 202.89.233.104.80: Flags [.], ack 24673, win 657, options [nop,nop,TS val 522919 ecr 186179247], length 0
09:58:54.097647 fc:d7:33:62:c8:2e > 24:0a:64:2a:99:fa, ethertype IPv4 (0x0800), length 1494: 202.89.233.104.80 > 192.168.0.106.55522: Flags [P.], seq 24673:26101, ack 1531, win 512, options [nop,nop,TS val 186179256 ecr 522896], length 1428
09:58:54.097679 24:0a:64:2a:99:fa > fc:d7:33:62:c8:2e, ethertype IPv4 (0x0800), length 66: 192.168.0.106.55522 > 202.89.233.104.80: Flags [.], ack 26101, win 680, options [nop,nop,TS val 522931 ecr 186179256], length 0
09:58:54.102526 fc:d7:33:62:c8:2e > 24:0a:64:2a:99:fa, ethertype IPv4 (0x0800), length 1494: 202.89.233.104.80 > 192.168.0.106.55522: Flags [.], seq 26101:27529, ack 1531, win 512, options [nop,nop,TS val 186179256 ecr 522896], length 1428
09:58:54.102561 24:0a:64:2a:99:fa > fc:d7:33:62:c8:2e, ethertype IPv4 (0x0800), length 66: 192.168.0.106.55522 > 202.89.233.104.80: Flags [.], ack 27529, win 702, options [nop,nop,TS val 522932 ecr 186179256], length 0
09:58:54.102593 fc:d7:33:62:c8:2e > 24:0a:64:2a:99:fa, ethertype IPv4 (0x0800), length 1494: 202.89.233.104.80 > 192.168.0.106.55522: Flags [.], seq 27529:28957, ack 1531, win 512, options [nop,nop,TS val 186179256 ecr 522896], length 1428
09:58:54.102603 24:0a:64:2a:99:fa > fc:d7:33:62:c8:2e, ethertype IPv4 (0x0800), length 66: 192.168.0.106.55522 > 202.89.233.104.80: Flags [.], ack 28957, win 725, options [nop,nop,TS val 522932 ecr 186179256], length 0
09:58:54.102612 fc:d7:33:62:c8:2e > 24:0a:64:2a:99:fa, ethertype IPv4 (0x0800), length 1494: 202.89.233.104.80 > 192.168.0.106.55522: Flags [.], seq 28957:30385, ack 1531, win 512, options [nop,nop,TS val 186179256 ecr 522896], length 1428
09:58:54.102619 24:0a:64:2a:99:fa > fc:d7:33:62:c8:2e, ethertype IPv4 (0x0800), length 66: 192.168.0.106.55522 > 202.89.233.104.80: Flags [.], ack 30385, win 748, options [nop,nop,TS val 522932 ecr 186179256], length 0
09:58:54.102625 fc:d7:33:62:c8:2e > 24:0a:64:2a:99:fa, ethertype IPv4 (0x0800), length 1494: 202.89.233.104.80 > 192.168.0.106.55522: Flags [.], seq 30385:31813, ack 1531, win 512, options [nop,nop,TS val 186179256 ecr 522896], length 1428
09:58:54.102631 24:0a:64:2a:99:fa > fc:d7:33:62:c8:2e, ethertype IPv4 (0x0800), length 66: 192.168.0.106.55522 > 202.89.233.104.80: Flags [.], ack 31813, win 770, options [nop,nop,TS val 522932 ecr 186179256], length 0
09:58:54.102636 fc:d7:33:62:c8:2e > 24:0a:64:2a:99:fa, ethertype IPv4 (0x0800), length 1494: 202.89.233.104.80 > 192.168.0.106.55522: Flags [.], seq 31813:33241, ack 1531, win 512, options [nop,nop,TS val 186179256 ecr 522919], length 1428
09:58:54.102642 24:0a:64:2a:99:fa > fc:d7:33:62:c8:2e, ethertype IPv4 (0x0800), length 66: 192.168.0.106.55522 > 202.89.233.104.80: Flags [.], ack 33241, win 793, options [nop,nop,TS val 522932 ecr 186179256], length 0
09:58:54.102647 fc:d7:33:62:c8:2e > 24:0a:64:2a:99:fa, ethertype IPv4 (0x0800), length 1494: 202.89.233.104.80 > 192.168.0.106.55522: Flags [P.], seq 33241:34669, ack 1531, win 512, options [nop,nop,TS val 186179256 ecr 522919], length 1428
09:58:54.102653 24:0a:64:2a:99:fa > fc:d7:33:62:c8:2e, ethertype IPv4 (0x0800), length 66: 192.168.0.106.55522 > 202.89.233.104.80: Flags [.], ack 34669, win 816, options [nop,nop,TS val 522932 ecr 186179256], length 0
09:58:54.102658 fc:d7:33:62:c8:2e > 24:0a:64:2a:99:fa, ethertype IPv4 (0x0800), length 1494: 202.89.233.104.80 > 192.168.0.106.55522: Flags [.], seq 36097:37525, ack 1531, win 512, options [nop,nop,TS val 186179256 ecr 522919], length 1428
09:58:54.102666 24:0a:64:2a:99:fa > fc:d7:33:62:c8:2e, ethertype IPv4 (0x0800), length 78: 192.168.0.106.55522 > 202.89.233.104.80: Flags [.], ack 34669, win 838, options [nop,nop,TS val 522932 ecr 186179256,nop,nop,sack 1 {36097:37525}], length 0
09:58:54.102671 fc:d7:33:62:c8:2e > 24:0a:64:2a:99:fa, ethertype IPv4 (0x0800), length 1494: 202.89.233.104.80 > 192.168.0.106.55522: Flags [.], seq 37525:38953, ack 1531, win 512, options [nop,nop,TS val 186179256 ecr 522919], length 1428
09:58:54.102678 24:0a:64:2a:99:fa > fc:d7:33:62:c8:2e, ethertype IPv4 (0x0800), length 78: 192.168.0.106.55522 > 202.89.233.104.80: Flags [.], ack 34669, win 861, options [nop,nop,TS val 522932 ecr 186179256,nop,nop,sack 1 {36097:38953}], length 0
09:58:54.102684 fc:d7:33:62:c8:2e > 24:0a:64:2a:99:fa, ethertype IPv4 (0x0800), length 1494: 202.89.233.104.80 > 192.168.0.106.55522: Flags [.], seq 38953:40381, ack 1531, win 512, options [nop,nop,TS val 186179256 ecr 522919], length 1428
09:58:54.102690 24:0a:64:2a:99:fa > fc:d7:33:62:c8:2e, ethertype IPv4 (0x0800), length 78: 192.168.0.106.55522 > 202.89.233.104.80: Flags [.], ack 34669, win 883, options [nop,nop,TS val 522932 ecr 186179256,nop,nop,sack 1 {36097:40381}], length 0
09:58:54.102694 fc:d7:33:62:c8:2e > 24:0a:64:2a:99:fa, ethertype IPv4 (0x0800), length 1494: 202.89.233.104.80 > 192.168.0.106.55522: Flags [.], seq 40381:41809, ack 1531, win 512, options [nop,nop,TS val 186179256 ecr 522919], length 1428
09:58:54.102700 24:0a:64:2a:99:fa > fc:d7:33:62:c8:2e, ethertype IPv4 (0x0800), length 78: 192.168.0.106.55522 > 202.89.233.104.80: Flags [.], ack 34669, win 906, options [nop,nop,TS val 522932 ecr 186179256,nop,nop,sack 1 {36097:41809}], length 0
09:58:54.102705 fc:d7:33:62:c8:2e > 24:0a:64:2a:99:fa, ethertype IPv4 (0x0800), length 1494: 202.89.233.104.80 > 192.168.0.106.55522: Flags [.], seq 41809:43237, ack 1531, win 512, options [nop,nop,TS val 186179256 ecr 522919], length 1428
09:58:54.102713 24:0a:64:2a:99:fa > fc:d7:33:62:c8:2e, ethertype IPv4 (0x0800), length 78: 192.168.0.106.55522 > 202.89.233.104.80: Flags [.], ack 34669, win 929, options [nop,nop,TS val 522932 ecr 186179256,nop,nop,sack 1 {36097:43237}], length 0
09:58:54.102718 fc:d7:33:62:c8:2e > 24:0a:64:2a:99:fa, ethertype IPv4 (0x0800), length 1494: 202.89.233.104.80 > 192.168.0.106.55522: Flags [P.], seq 43237:44665, ack 1531, win 512, options [nop,nop,TS val 186179256 ecr 522919], length 1428
09:58:54.102725 24:0a:64:2a:99:fa > fc:d7:33:62:c8:2e, ethertype IPv4 (0x0800), length 78: 192.168.0.106.55522 > 202.89.233.104.80: Flags [.], ack 34669, win 951, options [nop,nop,TS val 522932 ecr 186179256,nop,nop,sack 1 {36097:44665}], length 0
09:58:54.102730 fc:d7:33:62:c8:2e > 24:0a:64:2a:99:fa, ethertype IPv4 (0x0800), length 1494: 202.89.233.104.80 > 192.168.0.106.55522: Flags [.], seq 44665:46093, ack 1531, win 512, options [nop,nop,TS val 186179256 ecr 522919], length 1428
09:58:54.102736 24:0a:64:2a:99:fa > fc:d7:33:62:c8:2e, ethertype IPv4 (0x0800), length 78: 192.168.0.106.55522 > 202.89.233.104.80: Flags [.], ack 34669, win 974, options [nop,nop,TS val 522932 ecr 186179256,nop,nop,sack 1 {36097:46093}], length 0
09:58:54.102741 fc:d7:33:62:c8:2e > 24:0a:64:2a:99:fa, ethertype IPv4 (0x0800), length 1494: 202.89.233.104.80 > 192.168.0.106.55522: Flags [.], seq 46093:47521, ack 1531, win 512, options [nop,nop,TS val 186179256 ecr 522919], length 1428
09:58:54.102747 24:0a:64:2a:99:fa > fc:d7:33:62:c8:2e, ethertype IPv4 (0x0800), length 78: 192.168.0.106.55522 > 202.89.233.104.80: Flags [.], ack 34669, win 997, options [nop,nop,TS val 522932 ecr 186179256,nop,nop,sack 1 {36097:47521}], length 0
09:58:54.102751 fc:d7:33:62:c8:2e > 24:0a:64:2a:99:fa, ethertype IPv4 (0x0800), length 1494: 202.89.233.104.80 > 192.168.0.106.55522: Flags [.], seq 47521:48949, ack 1531, win 512, options [nop,nop,TS val 186179256 ecr 522919], length 1428
09:58:54.102758 24:0a:64:2a:99:fa > fc:d7:33:62:c8:2e, ethertype IPv4 (0x0800), length 78: 192.168.0.106.55522 > 202.89.233.104.80: Flags [.], ack 34669, win 1019, options [nop,nop,TS val 522932 ecr 186179256,nop,nop,sack 1 {36097:48949}], length 0
09:58:54.102763 fc:d7:33:62:c8:2e > 24:0a:64:2a:99:fa, ethertype IPv4 (0x0800), length 1494: 202.89.233.104.80 > 192.168.0.106.55522: Flags [.], seq 48949:50377, ack 1531, win 512, options [nop,nop,TS val 186179256 ecr 522919], length 1428
09:58:54.102770 24:0a:64:2a:99:fa > fc:d7:33:62:c8:2e, ethertype IPv4 (0x0800), length 78: 192.168.0.106.55522 > 202.89.233.104.80: Flags [.], ack 34669, win 1042, options [nop,nop,TS val 522932 ecr 186179256,nop,nop,sack 1 {36097:50377}], length 0
09:58:54.102775 fc:d7:33:62:c8:2e > 24:0a:64:2a:99:fa, ethertype IPv4 (0x0800), length 1494: 202.89.233.104.80 > 192.168.0.106.55522: Flags [P.], seq 50377:51805, ack 1531, win 512, options [nop,nop,TS val 186179256 ecr 522919], length 1428
09:58:54.102782 24:0a:64:2a:99:fa > fc:d7:33:62:c8:2e, ethertype IPv4 (0x0800), length 78: 192.168.0.106.55522 > 202.89.233.104.80: Flags [.], ack 34669, win 1064, options [nop,nop,TS val 522932 ecr 186179256,nop,nop,sack 1 {36097:51805}], length 0
09:58:54.102786 fc:d7:33:62:c8:2e > 24:0a:64:2a:99:fa, ethertype IPv4 (0x0800), length 1494: 202.89.233.104.80 > 192.168.0.106.55522: Flags [.], seq 51805:53233, ack 1531, win 512, options [nop,nop,TS val 186179256 ecr 522919], length 1428
09:58:54.102792 24:0a:64:2a:99:fa > fc:d7:33:62:c8:2e, ethertype IPv4 (0x0800), length 78: 192.168.0.106.55522 > 202.89.233.104.80: Flags [.], ack 34669, win 1087, options [nop,nop,TS val 522932 ecr 186179256,nop,nop,sack 1 {36097:53233}], length 0
09:58:54.102798 fc:d7:33:62:c8:2e > 24:0a:64:2a:99:fa, ethertype IPv4 (0x0800), length 1494: 202.89.233.104.80 > 192.168.0.106.55522: Flags [.], seq 53233:54661, ack 1531, win 512, options [nop,nop,TS val 186179256 ecr 522919], length 1428
09:58:54.102805 24:0a:64:2a:99:fa > fc:d7:33:62:c8:2e, ethertype IPv4 (0x0800), length 78: 192.168.0.106.55522 > 202.89.233.104.80: Flags [.], ack 34669, win 1110, options [nop,nop,TS val 522932 ecr 186179256,nop,nop,sack 1 {36097:54661}], length 0
09:58:54.102810 fc:d7:33:62:c8:2e > 24:0a:64:2a:99:fa, ethertype IPv4 (0x0800), length 1494: 202.89.233.104.80 > 192.168.0.106.55522: Flags [.], seq 57517:58945, ack 1531, win 512, options [nop,nop,TS val 186179257 ecr 522919], length 1428
09:58:54.102816 24:0a:64:2a:99:fa > fc:d7:33:62:c8:2e, ethertype IPv4 (0x0800), length 86: 192.168.0.106.55522 > 202.89.233.104.80: Flags [.], ack 34669, win 1132, options [nop,nop,TS val 522932 ecr 186179256,nop,nop,sack 2 {57517:58945}{36097:54661}], length 0
09:58:54.102821 fc:d7:33:62:c8:2e > 24:0a:64:2a:99:fa, ethertype IPv4 (0x0800), length 1494: 202.89.233.104.80 > 192.168.0.106.55522: Flags [P.], seq 58945:60373, ack 1531, win 512, options [nop,nop,TS val 186179257 ecr 522919], length 1428
09:58:54.102828 24:0a:64:2a:99:fa > fc:d7:33:62:c8:2e, ethertype IPv4 (0x0800), length 86: 192.168.0.106.55522 > 202.89.233.104.80: Flags [.], ack 34669, win 1155, options [nop,nop,TS val 522932 ecr 186179256,nop,nop,sack 2 {57517:60373}{36097:54661}], length 0
09:58:54.102833 fc:d7:33:62:c8:2e > 24:0a:64:2a:99:fa, ethertype IPv4 (0x0800), length 1494: 202.89.233.104.80 > 192.168.0.106.55522: Flags [.], seq 60373:61801, ack 1531, win 512, options [nop,nop,TS val 186179257 ecr 522919], length 1428
09:58:54.102840 24:0a:64:2a:99:fa > fc:d7:33:62:c8:2e, ethertype IPv4 (0x0800), length 86: 192.168.0.106.55522 > 202.89.233.104.80: Flags [.], ack 34669, win 1178, options [nop,nop,TS val 522932 ecr 186179256,nop,nop,sack 2 {57517:61801}{36097:54661}], length 0
